"Efficient 3D probabilistic stability analysis of rock tunnels using a Lattice Model and cloud computing; Lattice; Probabilistic; Rock tunnel; Cloud computing; NUMERICAL-SIMULATION; STOCHASTIC-ANALYSIS; FRACTURE; STRENGTH; BLOCK; NETWORKS; GEOMETRY; BEHAVIOR; PARTICLE. In this paper, the Classic Lattice Spring Model is developed in order to be applied to probabilistic stability analyses of rock tunnels in low in situ stress environments, where the falling of blocks is the main failure mechanism. For this objective, the method is combined with the Synthetic Rock Mass technique and Barton-Bandis joint constitutive model, giving it a series of advantages: simulations with deformable blocks; possible formation of tension cracks; and an appropriate constitutive model for the mechanical behavior of joints. The use of cloud computing technology is proposed for efficient probabilistic analyses using the Monte Carlo simulation. A case study is presented based on an unsupported section of a shallow rock tunnel excavated in the state of Espirito Santo, Brazil. A 3D probabilistic stability analysis of the tunnel is performed with the proposed methodology. From the results, a positional probability map is elaborated, which indicates the likelihood of block failure around the excavation cross-section. The unstable zones indicated by the map are then compared to the failed region of the real tunnel so as to demonstrate the competence of the methodology.""Resource allocation and routing in parallel multi-server queues with abandonments for cloud profit maximization; Parallel multi-server queues; Abandonments; Firm deadlines; Resource allocation; Routing; Markov decision process; Cloud computing; Bernoulli splitting; Index policies; LOAD DISTRIBUTION; OPTIMAL REPAIR; REAL-TIME; CUSTOMERS; OPTIMALITY; ADMISSION; SYSTEMS; SERVICE. This paper considers a Markov decision model for profit maximization of a cloud computing service provider catering to customers submitting jobs with firm real-time random deadlines. Customers are charged on a per-job basis, receiving a full refund if deadlines are missed. The service provider leases computing resources from an infrastructure provider in a two-tier scheme: long-term leasing of basic infrastructure, consisting of heterogeneous parallel service nodes, each modeled as a multi-server queue, and short-term leasing of external servers. Given the intractability of computing an optimal dynamic resource allocation and job routing policy, maximizing the long-run average profit rate, the paper addresses the design, implementation and testing of low-complexity heuristics. The policies considered are a static policy given by an optimal Bernoulli splitting, and three dynamic index policies based on different index definitions: individually optimal (IO), policy improvement (PI) and restless bandit (RB) indices. The paper shows how to implement efficiently each such policy, and presents a comprehensive empirical comparison, drawing qualitative insights on their strengths and weaknesses, and benchmarking their performance in an extensive study.""On semantic detection of cloud API (anti)patterns; Cloud computing; REST; OCCI; Pattern; Anti-pattern; Analysis; Specification; Detection; Ontology; . Context: Open standards are urgently needed for enabling software interoperability in Cloud Computing. Open Cloud Computing Interface (OCCI) provides a set of best design principles to create interoperable REST management APIs. Although OCCI is the only standard addressing the management of any kind of cloud resources, it does not support a range of best principles related to REST design. This often worsens REST API quality by decreasing their understandability and reusability. Objective: We aim at assisting cloud developers to enhance their REST management APIs by providing a compliance evaluation of OCCI and REST best principles and a recommendation support to comply with these principles. Method: First, we leverage patterns and anti-patterns to drive respectively the good and poor practices of OCCI and REST best principles. Then, we propose a semantic-based approach for defining and detecting REST and OCCI (anti)pattems and providing a set of correction recommendations to comply with both REST and OCCI best principles. We validated this approach by applying it on cloud REST APIs and evaluating its accuracy, usefulness and extensibility. Results: We found that our approach accurately detects OCCI and REST(anti)patterns and provides useful recommendations. According to the compliance results, we reveal that there is no widespread adoption of OCCI principles in existing APIs. In contrast, these APIs have reached an acceptable level of maturity regarding REST principles. Conclusion: Our approach provides an effective and extensible technique for defining and detecting OCCI and REST (anti)patterns in Cloud REST APIs. Cloud software developers can benefit from our approach and defined principles to accurately evaluate their APIs from OCCI and REST perspectives. This contributes in designing interoperable, understandable, and reusable Cloud management APIs. Thank to the compliance analysis and the recommendation support, we also contribute to improving these APIs, which make them more straightforward.""Modelling the utilization of cloud health information systems in the Iraqi public healthcare sector; Health information system; Health informatics; e-Health; Cloud computing; Model; Iraq; TECHNOLOGY ACCEPTANCE MODEL; CRITICAL SUCCESS FACTORS; PERCEIVED CONTROL; USER ACCEPTANCE; PRIVACY; DETERMINANTS; EXTENSION; CONTINUANCE; ADOPTION; INTENTIONS. The Iraqi healthcare sector has been suffering from health records management issues from the perspectives of low information technology integrity and data complexity. As a solution, cloud computing services can offer an alternative, low-cost, and reliable way to store, manage, and retrieve health-related data, as well as monitoring patients' health conditions anywhere and anytime using any device with any platform. The migration to cloud services is not yet widespread in Iraqi health facilities due to various challenges, including security and privacy, legal policies, and implementation. For instance, there has been no research shedding light on the utilization of cloud computing services in Iraqi hospitals' health information systems. This study proposed a model by defining the critical success factors influencing physicians' confirmation and behavioral control toward utilizing cloud health information systems in Iraqi hospitals. The model's variables were statistically investigated by utilizing an online questionnaire. Data were collected from a probability sample of 259 physicians working in four Iraqi high-IT hospitals. The collected ordinal data were analyzed using the PLS-SEM approach as a nonparametric second generation multivariate analysis. The results showed that the effects of system compatibility, system complexity, security, and privacy on physicians' confirmation and behavioral control were statistically significant. Both confirmation and behavioral control had a positive effect on physicians' utilization of the technology in the Iraqi hospitals. It is believed that such finding may help to aid the current understanding of cloud health systems in managing health data as well as providing the necessary recommendations for policy makers to direct healthcare professionals to continuously consider the use of modern information and communications technology in the workplace.""Exploring cloud-based Web Processing Service: A case study on the implementation of CMAQ as a Service; CMAQ; WPS; Cloud computing; Earth science model; Web service; OGC; MODELS; ECOSYSTEM; QUALITY; SYSTEM. As an important tool for air quality simulation, the Community Multiscale Air Quality (CMAQ) model is widely used in the environmental modeling community. However, setting up and running the CMAQ model could be challenging for many scientists, especially when they have limited computing resources and little experience in handling large-scale input data. In this study, we explore the cloud-based Web Processing Service (WPS) and present the Cloud WPS framework to support implementing Earth science model as WPS. Specifically, to make CMAQ easier to use for scientists through the latest standard-based Web service technology, CMAQ-WS, a prototype of CMAQ as a Service, is developed and tested. The result of the experiment shows the framework significantly improves not only the performance of but also ease of use of the CMAQ model thus providing great benefits to the environmental modeling community. Meanwhile, the proposed framework provides a general solution to integrate Earth science model, WPS, and cloud infrastructure, which can greatly reduce the workload of Earth scientists.""BMMI-tree: A Peer-to-Peer m-ary tree using 1-m node splitting for an efficient multidimensional complex query search; Distributed computing; Peer-to-peer networks; Multidimensional indexing; Node splitting; Multiway tree structures; Complex query search; DISCOVERY; SERVICE; OVERLAY. Peer-to-Peer (P2P) applications such as content distribution and sharing (like file, audio, video), multiuser communication (games, desktop sharing, e-learning) have emerged as a new paradigm over a last decade. However, scalability requirements remain a major concern and hence, the distribution and effective search of multidimensional data have become major challenges for P2P computing. Most of the existing P2P overlays either do not give support to Multidimensional Indexing (MI) or the frameworks are less efficient for complex query search or they are limited up to binary trees only, with the search complexity O(log(2)N). However, traditional MI based on m-ary tree is strengthened for the complex query search (bound to log(m)N) using higher fanout, m > 2. Based on these observations, we propose BMMI-tree (Balanced Multiway Multidimensional Indexing-tree) that uses an m-ary P2P tree overlay network and also provides the support of MI tree indexing methods such as R-tree or SS-tree in this paper. The paper also analyzes the complex query search algorithms performed in O(log(m)N) steps with the experimental results. In addition, the construction of the P2P tree network requires to split some existing node and its data objects into m new child nodes (during node join) and vice versa (during node leave). To the best of our knowledge, none of the existing node splitting algorithms for multiway multidimensional trees offer 1-m node splitting. Hence, in this paper, we also propose two different approaches to split the MI tree node into m number of nodes (m-ary split) to be used effectively to create a dynamic tree overlay. Lastly, we present how the BMMI-tree can be applied for service provisioning in cloud computing in a decentralized and distributed manner.""QaMeC: A QoS-driven IoVs application optimizing deployment scheme in multimedia edge clouds; IoVs (Internet of Vehicles); IoT(Internet of Things); Optimizing deployment; Cloud computing; Edge computing; Multi-clouds; QoS; CDN (Content Delivery Network, Content Distribution Network); . Deploying applications to a centralized cloud for service delivery is infeasible because of the excessive latency and bandwidth limitation of the Internet, such as transporting all IoVs data to big data processing service in a centralized cloud. Therefore, multi-clouds, especially multiple edge clouds is a rising trend for cloud service provision. However, heterogeneity of the cloud service, complex deployment requirements, and large problem space of multi-clouds deployment make how to deploy applications in the multi-clouds environment be a difficult and error-prone decision-making process. Due to these difficulties, current SIA-based solution lacks a unified model to represent functional and non-functional requirements of users. In this background, we propose a QoS-driven IoVs application optimizing deployment scheme in multimedia edge clouds (QaMeC). Our scheme builds a unified QoS model to shield off the inconsistency of QoS calculation. Moreover, we use NSGA-II algorithm to solve the multi-clouds application deployment problem. The implementation and experiments show that our QaMeC scheme can provide optimal and efficient service deployment solutions for a variety of applications with different QoS requirements in CDN multimedia edge clouds environment.""ITEMa: A methodological approach for cognitive edge computing IoT ecosystems; IoT-based ecosystems; Cognitive systems; Edge and cloud computing; Smart office; Activity recognition; SMART ENVIRONMENTS; INTERNET; SYSTEMS; THINGS; PLATFORM; DESIGN. The ever-increasing spread of Internet of Things (IoT)-based technologies paired with the diffusion of the edge-based computing boosts the development of pervasive cyber ecosystems having the goal of improving the life quality of people and assisting them in daily activities. In this context, cognitive behaviors are purposely required to make such ecosystems able to adapt to people needs and to envisage their behaviors. Despite the growing interest in cognitive ecosystems, still there is a lack of methodological approaches devoted to supporting the design and implementation of such complex systems. This paper proposes ITEMa, an Iot-based smarT Ecosystem Modeling Approach based on a three-layered architecture offering some well-suited abstractions tailored to the development of IoT-based ecosystems which exhibit cognitive behaviors and are able to exploit computational resources located either at the edge of the network or in the Cloud. The effectiveness of the approach is demonstrated through a case study concerning the development of a Smart Office devoted to forecast some usual office activities and to properly adapt the office environmental conditions to them.""Speed up genetic algorithms in the cloud using software containers; Genetic algorithms; Parallel genetic algorithms; Cloud computing; Software containers; Software engineering; . Scalability issues might prevent Genetic Algorithms from being applied to real world problems. Exploiting parallelisation in the cloud might be an affordable approach to getting time efficient solutions that benefit of the appealing features of scalability, resource discovery, reliability, fault-tolerance and costeffectiveness. Nevertheless, parallel computation is very prone to cause considerable overhead for communication. Also, making Genetic Algorithms distributed in an on-demand fashion is not trivial. Aiming at keeping under control the communication cost and, at the same time, supporting developers in the construction and deployment of parallel Genetic Algorithms, we designed and implemented a novel approach to distribute Genetic Algorithms in the form of a cloud-based application. It is based on the master/slave model, exploiting software containers, their cloud orchestration and message queues. We also devised a conceptual workflow covering each cloud Genetic Algorithms distribution phase, from resources allocation to actual deployment and execution, in an engineered fashion. Then, the application performance has been evaluated using a benchmark problem. According to the performance and setup times results, it emerged that the cloud can be considered a compelling way of scaling Genetic Algorithms and an excellent alternative to other technologies strictly related to the physically owned hardware.""Zeus: A resource allocation algorithm for the cloud of sensors; Cloud of sensors; Edge computing; Resource allocation; Mixed integer non-linear programming; Data provisioning; Data freshness; WIRELESS SENSOR; ENERGY-EFFICIENT; INTERNET; PERFORMANCE; SELECTION; SYSTEM. The cloud of sensors (CoS) paradigm brings together cloud computing, edge computing and wireless sensor and actuator networks (WSAN) in the form of a three-tier CoS architecture. By employing CoS virtualization, a set of virtual nodes (VNs) is made available to applications, decoupling them from the CoS infrastructure. Assigning VNs to application requests, in order to timely and efficiently meet application requirements, gives rise to the challenge of resource allocation in CoS. In this work, we formulate the problem of resource allocation in CoS and propose Zeus, a hybrid (partly-decentralized) algorithm for solving it. Zeus has two key features. First, it is able to identify requests that are common for multiple applications and perform only once their required tasks, sharing the results among the applications for saving resources. Second, its hybrid approach leveraging edge computing, makes Zeus scalable in terms of the number of VNs and applications supported, and suitable for meeting delay-sensitive applications.""Cross-layer multiuser session control for optimized communications on SDN-based cloud platforms; Cloud computing; Internet of things; Software defined networking; Cross-layer control plane; VIDEO; QUALITY; DELIVERY; SERVICE; ARCHITECTURE; EXPERIENCE; INTERNET; ISSUES; THINGS. The plethora of emerging applications and their increasing popularity has led to the cloudification of the Internet of Things (IoT). The IoT-cloudification scales up data centers to a high computational resource capacity, to suit the requirements of a large number of users wanting to access multiple services offered by revolutionary IoT applications which, in turn, consume huge amounts of data produced by billions of things. In such systems, IoT-tailored cloud services (e.g., software platforms and middleware) are responsible for running latency-critical IoT applications in different areas (e.g., healthcare, transport systems, safety, Smart Cities, and many others). These applications expect to produce high-density multimedia flows that must be handled appropriately by the underlying communication infrastructure to obtain transport services of the highest standard. In this work, we propose a novel control plane optimization, which leverages the support of the Software-Defined Networking (SDN) substrate so that it can advance beyond today's IP-based communication systems, which reveals weaknesses (e.g. a limited performance and scalability) in delivering multimedia content through per-flow channels. An attempt is made to overcome these limitations by proposing CLASSICO, a Cross-LAyer Sdn Session COntrol approach that exploits the SDN substrate to offload the flow streaming network-computing task from the IoT cloud platform to selected SDN branching nodes, and hence ensures high timeliness and scalability for the IoT-cloud system as a whole. To achieve this. CLASSICO dynamically builds application-layer sessions, which comprise multiple participant members sharing same interested content, and connects them into optimal multiuser tree structures, whereby only selected branching nodes apply SDN replication function for quality-enhanced transport service. We applied CLASSICO to a multimedia use case, and the results show that it outperforms multicast-capable IoT systems in terms of Quality of Service (QoS) and Quality of Experience (QoE) video assessment metrics.""SOGC: Implementing surrogate object garbage collector management for a Mobile Cloud Environment; big data management; garbage collection; mark-compact; memory management; Mobile Cloud Computing; quality in service; semi-space algorithm; . The aim of an ideal distributed Mobile Cloud environment, the surrogate object, is an agent for a particular Mobile Host in the wired or wireless network with specific data structures and methods. The Surrogate object is a software entity that is hosted on mobile support station and acts on behalf of a mobile host during the disconnection operation. The mobile hosts are registered with their own unique identifier in their cloud environment with their mobile support system. If the registered Mobile host is migrated from one cloud to another, the surrogate object handovers the data or resource management to another cloud with a new object with the same entities of old surrogate object, which leads inefficient. The granularity of object migration the old object is useless after the old object switched over into the new object. The collection of unused surrogate object is a big challenge. This problem will be achieved through the garbage collector technique in Mobile Cloud computing. In this research, we propose the Surrogate Object Garbage Collector (SOGC) model with new middleware consists in detecting the unused surrogate object by Mark-Compact Garbage Collection technique to recycle their object resources. SOGC periodically recycles the idle object and automatically reuses it; whenever it is needed to manage cloud environment, it results in quality-of-execution, low latency, and cost optimization in data management.""Tc-PEDCKS: Towards time controlled public key encryption with delegatable conjunctive keyword search for Internet of Things; Internet of Things; Keywords search; Time control; Keywords guessing attacks; PROXY RE-ENCRYPTION; GUESSING ATTACKS; SECURE; DATABASE; SCHEME; SUBSET. With the widespread adoption of Internet of Things (IoT) and cloud computing, more and more individuals and organizations are outsourcing their IoT data in the cloud server. Under these circumstances, how to protect the privacy and security of the outsourced data becomes a key challenge. Public key encryption with keyword search (PEKS) is a promising technology to solve the problem. In this paper, we present a new kind of PEKS named time controlled public key encryption with delegated conjunctive keyword search (tc-PEDCKS) for IoT deployment. A basic tc-PEDCKS is firstly presented which supports conjunctive keyword search and enables a data user to delegate access right over the data to others in a limited time period. To resist against the keyword guessing attacks, a more secure tc-PEDCKS with designated server construction is also presented. The two constructions are proved secure in the random oracle model. The performance evaluation and experimental results demonstrate that our constructions are practical and feasible for real world IoT scenarios.""A holistic review of Network Anomaly Detection Systems: A comprehensive survey; Intrusion Detection System (IDS); Network Anomaly Detection Systems (NADS); Data pre-processing; Decision Engine (DE); INTRUSION DETECTION SYSTEM; BIG DATA ANALYTICS; CLASSIFICATION; ENSEMBLE; FRAMEWORK; TAXONOMY; ATTACKS; DESIGN. Network Anomaly Detection Systems (NADSs) are gaining a more important role in most network defense systems for detecting and preventing potential threats. The paper discusses various aspects of anomaly-based Network Intrusion Detection Systems (NIDSs). The paper explains cyber kill chain models and cyber-attacks that compromise network systems, Moreover, the paper describes various Decision Engine (DE) approaches, including new ensemble learning and deep learning approaches. The paper also provides more details about benchmark datasets for training and validating DE approaches. Most of NADSs' applications, such as Data Centers, Internet of Things (IoT), as well as Fog and Cloud Computing, are also discussed. Finally, we present several experimental explanations which we follow by revealing various promising research directions."